{"endedAt":"2026-03-01T10:00:02Z","exports":{},"id":"sess_00000001","mediaMode":"hybrid","startedAt":"2026-03-01T10:00:00Z","steps":[{"action":"click","actionDescription":"Click \"Save\" in Docs — Safari","appName":"Safari","assets":{},"bundleIdentifier":"com.apple.Safari","coordinates":{"x":100,"y":200},"elementRole":"AXButton","elementTitle":"Save","id":"step-0001","index":1,"isCode":false,"timestamp":"2026-03-01T10:00:00Z","windowTitle":"Docs — Safari"},{"action":"write_code","actionDescription":"Run \"git status\" in Terminal","appName":"Terminal","assets":{},"id":"step-0002","index":2,"isCode":true,"isRedacted":false,"textBlob":"git status","timestamp":"2026-03-01T10:00:01Z","windowTitle":"zsh","workingDirectory":"~\/Code\/stepit"},{"action":"key_press","actionDescription":"Press ⌘S","appName":"Safari","assets":{},"hotkeyCombo":"⌘S","id":"step-0003","index":3,"isCode":false,"timestamp":"2026-03-01T10:00:02Z","windowTitle":"Docs — Safari"}],"theme":"modern-minimal","title":"Golden Session"}